{
  "id": "splunk",
  "name": "Splunk — notable events / alerts import",
  "type": "import",
  "category": "siem",
  "description": "Importe les notable events / alertes Splunk via l'API REST. Hôtes → ASSET, alertes → findings (VULNERABILITY) liés. Configuration par variables d'environnement du worker : SPLUNK_URL (ex. https://splunk:8089), SPLUNK_TOKEN (Bearer), SPLUNK_QUERY (déf. « search index=notable »), SPLUNK_VERIFY_TLS (déf. true).",
  "intrusive": false,
  "permission": "connector:splunk",
  "run": "run.py",
  "mapping": "splunk",
  "parameters": [
    { "name": "since_hours", "type": "int", "default": 24, "min": 1, "max": 720, "help": "Fenêtre temporelle (heures) à interroger" },
    { "name": "limit", "type": "int", "default": 200, "min": 1, "max": 5000, "help": "Nombre maximal d'alertes à importer" }
  ]
}
