{
  "id": "wiz",
  "name": "Wiz — cloud issues import",
  "type": "import",
  "category": "cnapp",
  "description": "Importe les Issues Wiz via l'API GraphQL (OAuth2 client_credentials). Entité concernée → ASSET, issue → finding lié. Configuration par variables d'environnement du worker : WIZ_CLIENT_ID, WIZ_CLIENT_SECRET, WIZ_API_URL (endpoint GraphQL, ex. https://api.<region>.app.wiz.io/graphql), WIZ_AUTH_URL (déf. https://auth.app.wiz.io/oauth/token).",
  "intrusive": false,
  "permission": "connector:wiz",
  "run": "run.py",
  "mapping": "wiz",
  "parameters": [
    { "name": "limit", "type": "int", "default": 200, "min": 1, "max": 2000, "help": "Nombre maximal d'issues à importer" }
  ]
}
