{
  "id": "caldera",
  "name": "MITRE Caldera — adversary emulation (agents & opérations)",
  "type": "import",
  "category": "adversary-emulation",
  "description": "Se connecte à un serveur MITRE Caldera (API v2) : importe les agents déployés en ASSET et les abilities exécutées lors des opérations en findings (technique ATT&CK liée à l'hôte). Lecture seule. Config UNIQUEMENT par variables d'environnement : CALDERA_URL + CALDERA_API_KEY.",
  "intrusive": false,
  "permission": "connector:caldera",
  "run": "run.py",
  "mapping": "caldera",
  "parameters": [
    { "name": "operation", "type": "string", "help": "Filtre par nom ou ID d'opération (vide = toutes les opérations)" },
    { "name": "agents_only", "type": "bool", "default": false, "help": "N'importer que l'inventaire des agents (ignore les résultats d'opérations)" }
  ]
}
