{
  "id": "qradar",
  "name": "IBM QRadar — offenses import",
  "type": "import",
  "category": "siem",
  "description": "Importe les offenses IBM QRadar via l'API REST (/api/siem/offenses). offense_source → ASSET, offense → finding lié. Configuration par variables d'environnement du worker : QRADAR_URL (ex. https://qradar.lab), QRADAR_TOKEN (en-tête SEC), QRADAR_VERIFY_TLS (déf. true).",
  "intrusive": false,
  "permission": "connector:qradar",
  "run": "run.py",
  "mapping": "qradar",
  "parameters": [
    { "name": "since_hours", "type": "int", "default": 24, "min": 1, "max": 720, "help": "Offenses mises à jour dans les N dernières heures" },
    { "name": "limit", "type": "int", "default": 200, "min": 1, "max": 5000, "help": "Nombre maximal d'offenses à importer" }
  ]
}
