{
  "id": "metasploit",
  "name": "Metasploit Framework — import db_export",
  "type": "import",
  "category": "exploitation",
  "description": "Importe un export Metasploit (msfconsole : db_export -f xml). Hôtes → ASSET, services → CPE/services, vulns → VULNERABILITY (CVE) + liens. Mode RPC optionnel (MSF_RPC_*).",
  "intrusive": false,
  "permission": "connector:metasploit",
  "run": "run.py",
  "mapping": "metasploit",
  "parameters": [
    { "name": "file", "type": "file", "required": true, "help": "Chemin de l'export XML Metasploit (db_export -f xml)" }
  ]
}
