{
  "id": "elastic-security",
  "name": "Elastic Security — detection alerts import",
  "type": "import",
  "category": "siem",
  "description": "Importe les alertes de détection Elastic Security via l'API de recherche Elasticsearch. host.name/host.ip → ASSET, alertes → findings liés. Configuration par variables d'environnement du worker : ELASTIC_URL (ex. https://es:9200), ELASTIC_API_KEY, ELASTIC_INDEX (déf. .alerts-security.alerts-default), ELASTIC_VERIFY_TLS (déf. true).",
  "intrusive": false,
  "permission": "connector:elastic-security",
  "run": "run.py",
  "mapping": "elastic-security",
  "parameters": [
    { "name": "since_hours", "type": "int", "default": 24, "min": 1, "max": 720, "help": "Fenêtre temporelle (heures) à interroger" },
    { "name": "limit", "type": "int", "default": 200, "min": 1, "max": 5000, "help": "Nombre maximal d'alertes à importer" }
  ]
}
